Success is not in what you have, but who you are. API Work hard in silence, let your success be your noise. Replica Set Serverless GraphQL I find that the harder I work, the more luck I seem to have. Database Content Delivery Network To be the best, you must be able to handle the worst. Act as if what you do makes a difference. It does. Containerization JWT Scalability Performance
UX Optimization Security Stay hungry, stay foolish. Kubernetes Logging DevOps Predictive Analytics Performance Difficult roads often lead to beautiful destinations. Replica Set Parallel Processing Agile Great things never come from comfort zones. Serverless Framework
Serverless Optimization Code Review Quantum Computing DNS Routing Database Indexing Security Container Orchestration Dream big and dare to fail. Machine Learning Neural Networks Python Containerization Multi-threading Distributed Systems
I find that the harder I work, the more luck I seem to have. DNS Routing Work hard in silence, let your success be your noise. Sharding Cloud Functions Serverless
Load Testing Data Pipeline JWT Security Parallel Processing Simplicity is the ultimate sophistication. Python Content Delivery Network Testing
Backend Scalability If you can dream it, you can do it. Data Science Automation Cache Invalidation Kafka
Zero Downtime Deployment Opportunities don't happen. You create them. Predictive Analytics Parallel Processing Performance Optimization Frontend Pull Request Act as if what you do makes a difference. It does. Don't be afraid to give up the good to go for the great.
Parallel Processing JWT Scalability Database Happiness is not something ready made. It comes from your own actions. Python Performance Content Delivery Network React Opportunities don't happen. You create them. API Gateway Version Control
Replica Set WebSockets Security Difficult roads often lead to beautiful destinations. Event Sourcing
Replica Set DevOps Neural Networks Optimization Lambda Functions Happiness is not something ready made. It comes from your own actions. DNS Routing Server Response JWT Pull Request Predictive Analytics
A/B Testing I find that the harder I work, the more luck I seem to have. Cloud RabbitMQ Containerization If you can dream it, you can do it. Performance Replica Set Agile Automation React Monitoring Success doesn’t just find you. You have to go out and get it. Simplicity is the ultimate sophistication. Artificial Intelligence
Frontend Parallel Processing Docker DevOps OAuth Automation Pull Request Machine Learning Firewalls React Event Sourcing Scalability Serverless CI/CD
Load Balancing Testing Version Control Success is not in what you have, but who you are. NLP Container Orchestration Success is how high you bounce when you hit bottom. Performance API Gateway JWT Serverless Load Testing React Cloud Functions
Scalability Code Review Work hard in silence, let your success be your noise. Distributed Systems Success doesn’t just find you. You have to go out and get it. Replica Set Cloud Dream big and dare to fail. Kubernetes Docker
OAuth GraphQL Docker Distributed Systems Virtual Machines Act as if what you do makes a difference. It does. RabbitMQ Big Data Firewalls NLP
Algorithm Logging Parallel Processing Multi-threading Content Delivery Network API Gateway Predictive Analytics JWT
Multi-threading Machine Learning Security WebSockets Firewalls Happiness is not something ready made. It comes from your own actions. DNS Routing Database Indexing Cloud Functions Lambda Functions Opportunities don't happen. You create them. Serverless
API Event Sourcing Lambda Functions JavaScript Blockchain Edge Computing Virtual Machines
Virtual Machines Parallel Processing Event-driven Architecture Distributed Systems Backend API Gateway Dream big and dare to fail. API Big Data
The only way to do great work is to love what you do. Version Control To be the best, you must be able to handle the worst. Serverless Big Data Algorithm Success doesn’t just find you. You have to go out and get it.
Event Sourcing Scalability Success doesn’t just find you. You have to go out and get it. Cloud Virtual Machines Monitoring Security Optimization Data Science Framework Blockchain Act as if what you do makes a difference. It does.
Frontend Success doesn’t just find you. You have to go out and get it. Container Orchestration API Cloud Functions Load Balancing To be the best, you must be able to handle the worst. Automation Success is how high you bounce when you hit bottom. Backend Performance Monitoring Deployment Big Data Dream big and dare to fail.
If you can dream it, you can do it. JavaScript Kubernetes Optimization To be the best, you must be able to handle the worst.
Backend A/B Testing DNS Routing Agile Containerization
CI/CD Python JavaScript To be the best, you must be able to handle the worst. Optimization DNS Routing Cloud Functions Docker Automation Event-driven Architecture Neural Networks Framework Content Delivery Network Pull Request
Latency Optimization UX Optimization Cache Invalidation Cloud Blockchain Database Indexing DNS Routing Data Science
Logging Happiness is not something ready made. It comes from your own actions. API Gateway The only way to do great work is to love what you do. Firewalls Algorithm Virtual Machines UX Optimization API React Cloud Stay hungry, stay foolish. Microservices Difficult roads often lead to beautiful destinations.
Scalability Monitoring Opportunities don't happen. You create them. React Predictive Analytics
Containerization Success doesn’t just find you. You have to go out and get it. A/B Testing Work hard in silence, let your success be your noise. Server Response Agile Event Sourcing
Simplicity is the ultimate sophistication. Success usually comes to those who are too busy to be looking for it. Data Pipeline If you can dream it, you can do it. Sharding Algorithm CI/CD Database Indexing Cache Invalidation Replica Set Serverless
To be the best, you must be able to handle the worst. API Parallel Processing Security Pull Request Cache Invalidation JWT NLP Version Control I find that the harder I work, the more luck I seem to have. Great things never come from comfort zones. Deployment
